{
  "$schema": "https://grida.co/schema/dotcanvas/v1.json",
  "documents": [
    {
      "id": "intro",
      "name": "Title",
      "src": "001.svg"
    },
    {
      "id": "chart",
      "layout": {
        "h": 1080,
        "w": 1920,
        "x": 0,
        "y": 0,
        "z": 0
      },
      "name": "Chart",
      "src": "002.svg"
    },
    {
      "id": "thanks",
      "name": "Thanks",
      "src": "003.svg"
    }
  ],
  "ext": {
    "co.grida.svg-demo": {
      "activeId": "intro"
    }
  },
  "files": ["*.svg"],
  "editor": "slides",
  "version": "1"
}
